"sprint_number","sprint_name","sprint_goal","start_date","end_date","duration_days","total_story_points","estimated_hours","team_capacity_hours","capacity_utilization","task_count","epic_coverage","key_deliverables","demo_objectives","success_criteria","risk_factors","mitigation_strategies","dependencies_resolved","team_members","external_dependencies","integration_windows","review_schedule","retrospective_date","burndown_target"
"1","Sprint 1: Infrastructure & CI Foundation","Establish foundational cloud infrastructure (VPC, EKS) and CI pipeline to enable initial service deployments.","2024-06-24","2024-07-05","10","21","74.5","288","26%","3","Core Platform Infrastructure & DevOps","Isolated VPCs for all environments; Scalable EKS cluster in dev; Reusable CI workflow for backend services.","Show provisioned AWS resources via console; Demonstrate a successful CI pipeline run on a sample PR.","Terraform apply completes successfully for all infra; CI pipeline passes for a valid PR and fails for an invalid one.","Complexity of EKS and IAM configuration; Delays in AWS resource provisioning.","Use official Terraform modules; Allocate buffer time for debugging infra setup.","true","devops.engineer@company.com","","","2024-07-05","2024-07-05","Linear burndown of tasks and story points."
"2","Sprint 2: Data Stores & CD Pipeline","Provision core data stores (RDS, Redis), establish the automated CD pipeline, and enforce code quality with branch protection.","2024-07-08","2024-07-19","10","17","64.5","288","22%","4","Core Platform Infrastructure & DevOps","Multi-AZ RDS PostgreSQL instance; ElastiCache for Redis cluster; Reusable CD workflow for automated deployments; Branch protection on `main`.","Demonstrate automated deployment of a sample service from a PR merge to running in EKS; Show branch protection blocking a non-compliant PR.","Data stores are provisioned and accessible from EKS; CD pipeline successfully deploys a change to the dev cluster.","RISK-007: Misconfiguration of security groups; RISK-006: Failed deployment could cause downtime if not handled properly.","Peer review of all Terraform code; Ensure Kubernetes readiness probes are well-configured.","true","devops.engineer@company.com","","","2024-07-19","2024-07-19","Linear burndown of tasks and story points."
"3","Sprint 3: Observability & User Registration","Establish observability (Monitoring & Alerting) and implement the core User Registration flow with OTP.","2024-07-22","2024-08-02","10","23","98.5","288","34%","4","Core Platform Infrastructure & DevOps,Identity & Access Service","Deployed Prometheus & Grafana stack; Configured Alertmanager with test alerts; Backend API for OTP-based user registration.","Show a Grafana dashboard with live cluster metrics; Trigger a test alert and show the notification in Slack; Demonstrate a successful user registration via API.","Prometheus scrapes metrics from a sample app; A test alert is successfully delivered; The registration API creates a user in PostgreSQL and Cognito.","RISK-008: Delays or failures in the SMS gateway; Complexity in debugging alerting pipeline.","Implement robust error logging and monitoring for SMS gateway; Use test alerts to verify the full alerting pipeline.","true","devops.engineer@company.com,backend.dev1@company.com","AWS SNS, AWS Cognito","","2024-08-02","2024-08-02","Linear burndown of tasks and story points."
"4","Sprint 4: Authentication & Financial Foundation","Complete core authentication (Login, RBAC, Refresh Tokens) and establish the immutable financial ledger.","2024-08-05","2024-08-16","10","19","96","288","33%","4","Identity & Access Service,Payments, Settlements & Reporting","OTP-based login API; Refresh token mechanism; Reusable RBAC Guard; Double-entry financial ledger service.","Demonstrate user login via API; Show an expired access token being refreshed; Demonstrate an RBAC-protected endpoint; Show balanced transactions in the financial ledger.","Login and refresh token flows are fully functional and secure; RBAC guard correctly blocks unauthorized access; All financial transactions are balanced.","Complexity of secure token management; Ensuring the financial ledger is truly immutable and auditable.","Follow security best practices for JWTs; Implement strict database permissions on the ledger table.","true","backend.dev1@company.com,backend.dev2@company.com","","","2024-08-16","2024-08-16","Linear burndown of tasks and story points."
"5","Sprint 5: Admin & Onboarding Foundation","Implement foundational Admin user management, the immutable audit trail, and the initial Vendor/Rider registration backend services.","2024-08-19","2024-08-30","10","21","105","288","36%","4","Identity & Access Service,Vendor & Catalog Service,Rider Logistics Service","Admin user management API (suspend/deactivate); Immutable audit trail service; Vendor and Rider registration submission APIs.","Demonstrate suspending a user via API and confirming the action is logged in the audit trail; Show successful submission of vendor and rider registration applications.","Admin actions are correctly logged; Vendor/Rider applications create `pending_verification` records in the database.","Complexity of a transactional and reliable audit trail mechanism.","Use NestJS interceptors or middleware to automate logging; ensure audit log creation is part of the main DB transaction.","true","backend.dev1@company.com,backend.dev2@company.com,frontend.dev1@company.com","","","2024-08-30","2024-08-30","Linear burndown of tasks and story points."
"6","Sprint 6: Vendor Catalog Management","Build the core vendor catalog management features, allowing vendors to manage their profile, categories, and products.","2024-09-02","2024-09-13","10","18","90","288","31%","4","Vendor & Catalog Service","API endpoints for managing vendor store profile and business hours; Full CRUD APIs for product categories and individual products.","Demonstrate creating a new product category, adding a product with an image to it, and updating its price via API.","All CRUD operations for categories and products are functional and secure; Image uploads to S3 are successful.","Handling file uploads securely and efficiently.","Use pre-signed S3 URLs for direct client uploads to offload server resources.","true","backend.dev2@company.com,frontend.dev2@company.com","AWS S3","","2024-09-13","2024-09-13","Linear burndown of tasks and story points."
"7","Sprint 7: Customer Product Discovery","Develop the customer-facing product discovery features, including viewing nearby vendors, search, and filtering.","2024-09-16","2024-09-27","10","20","100","288","35%","4","Customer Ordering and Checkout","Customer mobile app screens for vendor list, search results, and vendor profile; Backend search integration with OpenSearch.","Show the customer app displaying nearby vendors based on location; Demonstrate searching for a vendor/item with typo tolerance; Filter search results by rating and category.","Geospatial search for vendors is functional and performant; Search API meets latency requirements; Filtering updates results correctly.","RISK-003: Performance of geospatial queries at scale; Complexity of OpenSearch integration and data indexing.","Ensure proper PostGIS indexing; Conduct load testing of the search API early.","true","frontend.dev1@company.com,frontend.dev2@company.com,backend.dev1@company.com,qa.engineer@company.com","Amazon OpenSearch Service","","2024-09-27","2024-09-27","Linear burndown of tasks and story points."
"8","Sprint 8: Cart & Payment Integration","Implement core shopping cart functionality and integrate with the Razorpay payment gateway.","2024-09-30","2024-10-11","10","16","80","288","28%","3","Customer Ordering and Checkout,Payments, Settlements & Reporting","Order data model and schema; Shopping cart management APIs (add, update, remove); Integration with Razorpay for creating payment orders and handling webhooks.","Demonstrate adding an item to the cart, viewing the cart, and being redirected to the Razorpay payment page.","Cart operations are functional; Razorpay integration can successfully initiate a payment.","RISK-002: Dependency on Razorpay API; Ensuring PCI-DSS compliance by not handling sensitive card data.","Implement circuit breakers for Razorpay API calls; Use Razorpay's client-side SDKs to handle card data.","true","backend.dev2@company.com,frontend.dev1@company.com,qa.engineer@company.com","Razorpay","","2024-10-11","2024-10-11","Linear burndown of tasks and story points."
"9","Sprint 9: Checkout Orchestration & Cancellation","Implement the complex checkout orchestration Saga and the customer order cancellation logic.","2024-10-14","2024-10-25","10","18","90","288","31%","2","Customer Ordering and Checkout","End-to-end order placement flow using a Saga pattern; Order cancellation API with business rules for refunds and fees.","Demonstrate a complete, successful order placement; Demonstrate cancelling an order within the grace period for a full refund.","Checkout Saga correctly coordinates across services; Compensating transactions are triggered on failure; Cancellation logic is correctly applied.","RISK-001: High complexity of Saga pattern implementation and testing all failure paths.","Mandate a formal design review; Develop a comprehensive integration test suite for the Saga.","true","backend.dev1@company.com,backend.dev2@company.com,qa.engineer@company.com","","","2024-10-25","2024-10-25","Linear burndown of tasks and story points."
"10","Sprint 10: Rider Onboarding & Core Logistics","Implement the rider registration flow and the core rider allocation engine.","2024-10-28","2024-11-08","10","20","100","288","35%","3","Rider Logistics Service","Rider registration API; Rider availability status management; The core rider allocation algorithm.","Demonstrate a new order triggering the allocation service; Show the service selecting the best rider and offering the task.","Rider registration is functional; Rider availability status impacts allocation eligibility; Allocation algorithm correctly identifies and offers tasks.","RISK-003: Performance of the geospatial queries in the allocation algorithm.","Ensure proper PostGIS indexing and conduct load testing.","true","backend.dev1@company.com,backend.dev2@company.com,frontend.dev2@company.com","","","2024-11-08","2024-11-08","Linear burndown of tasks and story points."
"11","Sprint 11: Live Tracking & Proof of Delivery","Build the end-to-end live order tracking feature and the Proof of Delivery (POD) submission flows.","2024-11-11","2024-11-22","10","15","75","288","26%","3","Rider Logistics Service","Location ingestion and broadcast service; Customer-facing map with live rider movement; Rider-facing photo and OTP POD submission flows.","Show a rider's icon moving on the customer's map; Demonstrate a rider completing a delivery by submitting a photo POD.","Live tracking is smooth and accurate; POD submissions are successfully stored and linked to the order.","Battery consumption on rider devices; Scalability of WebSocket infrastructure.","Optimize background location services; Load test the WebSocket gateway.","true","frontend.dev1@company.com,frontend.dev2@company.com,backend.dev1@company.com,qa.engineer@company.com","Mapbox","","2024-11-22","2024-11-22","Linear burndown of tasks and story points."
"12","Sprint 12: Financial Settlements & Payouts","Complete the financial cycle by implementing commission calculations and automated weekly payouts for vendors and riders.","2024-11-25","2024-12-06","10","26","130","288","45%","4","Payments, Settlements & Reporting","Commission calculation service; RazorpayX Payouts integration; Automated weekly settlement jobs for riders and vendors.","Demonstrate a completed order correctly generating a commission transaction; Show a weekly settlement job calculating a net payout and initiating it via RazorpayX.","Commission calculations are accurate; Payout jobs are idempotent and process correct amounts; All financial flows are verified in the RazorpayX sandbox.","Accuracy of financial calculations; Reliability of the external Payouts API.","Rigorous testing with a wide range of scenarios; Robust error handling and alerting for the settlement jobs.","true","backend.dev1@company.com,backend.dev2@company.com,qa.engineer@company.com","RazorpayX","","2024-12-06","2024-12-06","Linear burndown of tasks and story points."